[
  {
    "id": "lu.11.01",
    "grade": 11,
    "title": "Atom tuzilishi",
    "chapter": "1-bob, 1-§, 4-10-betlar",
    "learningOutcomes": [
      "Atom tuzilishi model/trenajyor orqali o‘zlashtiriladi."
    ],
    "conceptIds": [
      "concept.c284",
      "concept.c285",
      "concept.c286",
      "concept.c287"
    ],
    "prerequisiteConceptIds": [],
    "lessonTemplates": [],
    "curriculumVersion": "2026.09",
    "sourceRefs": [
      {
        "id": "src.legacy.11.01",
        "type": "internal",
        "title": "1-bob, 1-§, 4-10-betlar"
      }
    ],
    "legacyIds": [
      "11.01"
    ]
  },
  {
    "id": "lu.11.02",
    "grade": 11,
    "title": "Davriy qonun va D.I. Mendeleyev davriy sistemasi",
    "chapter": "1-bob, 2-§, 11-15-betlar",
    "learningOutcomes": [
      "Davriy qonun uchun interaktiv trendlar asosiy amaliyot."
    ],
    "conceptIds": [
      "concept.c288",
      "concept.c289"
    ],
    "prerequisiteConceptIds": [],
    "lessonTemplates": [],
    "curriculumVersion": "2026.09",
    "sourceRefs": [
      {
        "id": "src.legacy.11.02",
        "type": "internal",
        "title": "1-bob, 2-§, 11-15-betlar"
      }
    ],
    "legacyIds": [
      "11.02"
    ]
  },
  {
    "id": "lu.11.03",
    "grade": 11,
    "title": "Atom tarkibi va yadro reaksiyalari",
    "chapter": "1-bob, 3-§, 16-22-betlar",
    "learningOutcomes": [
      "Yadro reaksiyalari uchun xavfsiz raqamli simulyatsiya zarur."
    ],
    "conceptIds": [
      "concept.c290",
      "concept.c291",
      "concept.c292",
      "concept.c293"
    ],
    "prerequisiteConceptIds": [],
    "lessonTemplates": [],
    "curriculumVersion": "2026.09",
    "sourceRefs": [
      {
        "id": "src.legacy.11.03",
        "type": "internal",
        "title": "1-bob, 3-§, 16-22-betlar"
      }
    ],
    "legacyIds": [
      "11.03"
    ]
  },
  {
    "id": "lu.11.04",
    "grade": 11,
    "title": "Kimyoviy bog‘lanish turlari va kristall panjaralar",
    "chapter": "1-bob, 4-§, 23-30-betlar",
    "learningOutcomes": [
      "Tuzilish–xossa bog‘ini model orqali qo‘llash kerak."
    ],
    "conceptIds": [
      "concept.c294",
      "concept.c295",
      "concept.c296"
    ],
    "prerequisiteConceptIds": [],
    "lessonTemplates": [],
    "curriculumVersion": "2026.09",
    "sourceRefs": [
      {
        "id": "src.legacy.11.04",
        "type": "internal",
        "title": "1-bob, 4-§, 23-30-betlar"
      }
    ],
    "legacyIds": [
      "11.04"
    ]
  },
  {
    "id": "lu.11.05",
    "grade": 11,
    "title": "Modda miqdori",
    "chapter": "2-bob, 5-§, 31-33-betlar",
    "learningOutcomes": [
      "Modda miqdori sonli mavzu."
    ],
    "conceptIds": [
      "concept.c038",
      "concept.c297",
      "concept.c298"
    ],
    "prerequisiteConceptIds": [],
    "lessonTemplates": [],
    "curriculumVersion": "2026.09",
    "sourceRefs": [
      {
        "id": "src.legacy.11.05",
        "type": "internal",
        "title": "2-bob, 5-§, 31-33-betlar"
      }
    ],
    "legacyIds": [
      "11.05"
    ]
  },
  {
    "id": "lu.11.06",
    "grade": 11,
    "title": "Avogadro qonuni va gazlar aralashmasi",
    "chapter": "2-bob, 6-§, 34-38-betlar",
    "learningOutcomes": [
      "Gaz tarkibi/hajmi bilan sonli ishlash kerak."
    ],
    "conceptIds": [
      "concept.c118",
      "concept.c076",
      "concept.c299"
    ],
    "prerequisiteConceptIds": [],
    "lessonTemplates": [],
    "curriculumVersion": "2026.09",
    "sourceRefs": [
      {
        "id": "src.legacy.11.06",
        "type": "internal",
        "title": "2-bob, 6-§, 34-38-betlar"
      }
    ],
    "legacyIds": [
      "11.06"
    ]
  },
  {
    "id": "lu.11.07",
    "grade": 11,
    "title": "Ekvivalent",
    "chapter": "2-bob, 7-§, 39-44-betlar",
    "learningOutcomes": [
      "Mavzu hisoblash amaliyotiga asoslangan."
    ],
    "conceptIds": [
      "concept.c300"
    ],
    "prerequisiteConceptIds": [],
    "lessonTemplates": [],
    "curriculumVersion": "2026.09",
    "sourceRefs": [
      {
        "id": "src.legacy.11.07",
        "type": "internal",
        "title": "2-bob, 7-§, 39-44-betlar"
      }
    ],
    "legacyIds": [
      "11.07"
    ]
  },
  {
    "id": "lu.11.08",
    "grade": 11,
    "title": "Mendeleyev-Klapeyron tenglamasi",
    "chapter": "2-bob, 8-§, 45-50-betlar",
    "learningOutcomes": [
      "Mendeleyev–Klapeyron tenglamasini slayder va hisob bilan qo‘llash."
    ],
    "conceptIds": [
      "concept.c301",
      "concept.c302"
    ],
    "prerequisiteConceptIds": [],
    "lessonTemplates": [],
    "curriculumVersion": "2026.09",
    "sourceRefs": [
      {
        "id": "src.legacy.11.08",
        "type": "internal",
        "title": "2-bob, 8-§, 45-50-betlar"
      }
    ],
    "legacyIds": [
      "11.08"
    ]
  },
  {
    "id": "lu.11.09",
    "grade": 11,
    "title": "Kuchli va kuchsiz elektrolitlar",
    "chapter": "3-bob, 9-§, 51-53-betlar",
    "learningOutcomes": [
      "Katalogda maxsus laboratoriya yo‘q; raqamli tajriba kerak."
    ],
    "conceptIds": [
      "concept.c303",
      "concept.c304"
    ],
    "prerequisiteConceptIds": [],
    "lessonTemplates": [],
    "curriculumVersion": "2026.09",
    "sourceRefs": [
      {
        "id": "src.legacy.11.09",
        "type": "internal",
        "title": "3-bob, 9-§, 51-53-betlar"
      }
    ],
    "legacyIds": [
      "11.09"
    ]
  },
  {
    "id": "lu.11.10",
    "grade": 11,
    "title": "Dissotsiatsiyalanish darajasi va ionli tenglamalar",
    "chapter": "3-bob, 10-§, 54-57-betlar",
    "learningOutcomes": [
      "Ionlar bilan operatsion ishlash asosiy amaliyot."
    ],
    "conceptIds": [
      "concept.c151",
      "concept.c305"
    ],
    "prerequisiteConceptIds": [],
    "lessonTemplates": [],
    "curriculumVersion": "2026.09",
    "sourceRefs": [
      {
        "id": "src.legacy.11.10",
        "type": "internal",
        "title": "3-bob, 10-§, 54-57-betlar"
      }
    ],
    "legacyIds": [
      "11.10"
    ]
  },
  {
    "id": "lu.11.11",
    "grade": 11,
    "title": "Tuzlar gidrolizi va eritma muhiti",
    "chapter": "3-bob, 11-§, 58-61-betlar",
    "learningOutcomes": [
      "Tuz tanlab muhitni aniqlash va tenglama tuzish."
    ],
    "conceptIds": [
      "concept.c156",
      "concept.c306",
      "concept.c061"
    ],
    "prerequisiteConceptIds": [],
    "lessonTemplates": [],
    "curriculumVersion": "2026.09",
    "sourceRefs": [
      {
        "id": "src.legacy.11.11",
        "type": "internal",
        "title": "3-bob, 11-§, 58-61-betlar"
      }
    ],
    "legacyIds": [
      "11.11"
    ]
  },
  {
    "id": "lu.11.12",
    "grade": 11,
    "title": "Eritma va eruvchanlik",
    "chapter": "4-bob, 12-14-§, 62-72-betlar",
    "learningOutcomes": [
      "Harorat–eruvchanlik bog‘ini grafik/sonli ko‘rish."
    ],
    "conceptIds": [
      "concept.c307",
      "concept.c308",
      "concept.c309",
      "concept.c310"
    ],
    "prerequisiteConceptIds": [],
    "lessonTemplates": [],
    "curriculumVersion": "2026.09",
    "sourceRefs": [
      {
        "id": "src.legacy.11.12",
        "type": "internal",
        "title": "4-bob, 12-14-§, 62-72-betlar"
      }
    ],
    "legacyIds": [
      "11.12"
    ]
  },
  {
    "id": "lu.11.13",
    "grade": 11,
    "title": "Foiz konsentratsiya",
    "chapter": "4-bob, 15-17-§, 73-84-betlar",
    "learningOutcomes": [
      "Suv/modda miqdori bilan realistik hisoblash amaliyoti."
    ],
    "conceptIds": [
      "concept.c311",
      "concept.c312",
      "concept.c313"
    ],
    "prerequisiteConceptIds": [],
    "lessonTemplates": [],
    "curriculumVersion": "2026.09",
    "sourceRefs": [
      {
        "id": "src.legacy.11.13",
        "type": "internal",
        "title": "4-bob, 15-17-§, 73-84-betlar"
      }
    ],
    "legacyIds": [
      "11.13"
    ]
  },
  {
    "id": "lu.11.14",
    "grade": 11,
    "title": "Molyar va normal konsentratsiya hamda bog‘lanishlar",
    "chapter": "4-bob, 18-21-§, 85-97-betlar",
    "learningOutcomes": [
      "Konsentratsiya birliklari orasidagi bog‘lanishni mashq qiladi."
    ],
    "conceptIds": [
      "concept.c314",
      "concept.c315",
      "concept.c316"
    ],
    "prerequisiteConceptIds": [],
    "lessonTemplates": [],
    "curriculumVersion": "2026.09",
    "sourceRefs": [
      {
        "id": "src.legacy.11.14",
        "type": "internal",
        "title": "4-bob, 18-21-§, 85-97-betlar"
      }
    ],
    "legacyIds": [
      "11.14"
    ]
  },
  {
    "id": "lu.11.15",
    "grade": 11,
    "title": "Reaksiya tezligi",
    "chapter": "5-bob, 22-§, 98-103-betlar",
    "learningOutcomes": [
      "Tezlikni grafik va sonli tahlil qilish."
    ],
    "conceptIds": [
      "concept.c126",
      "concept.c317"
    ],
    "prerequisiteConceptIds": [],
    "lessonTemplates": [],
    "curriculumVersion": "2026.09",
    "sourceRefs": [
      {
        "id": "src.legacy.11.15",
        "type": "internal",
        "title": "5-bob, 22-§, 98-103-betlar"
      }
    ],
    "legacyIds": [
      "11.15"
    ]
  },
  {
    "id": "lu.11.16",
    "grade": 11,
    "title": "Bosim, hajm, harorat va katalizatorning reaksiya tezligiga ta’siri",
    "chapter": "5-bob, 23-§, 104-108-betlar",
    "learningOutcomes": [
      "Ko‘p omilli tezlik tajribasi katalogda yo‘q."
    ],
    "conceptIds": [
      "concept.c318",
      "concept.c319"
    ],
    "prerequisiteConceptIds": [],
    "lessonTemplates": [],
    "curriculumVersion": "2026.09",
    "sourceRefs": [
      {
        "id": "src.legacy.11.16",
        "type": "internal",
        "title": "5-bob, 23-§, 104-108-betlar"
      }
    ],
    "legacyIds": [
      "11.16"
    ]
  },
  {
    "id": "lu.11.17",
    "grade": 11,
    "title": "Qaytar va qaytmas reaksiyalar. Kimyoviy muvozanat",
    "chapter": "6-bob, 25-§, 112-115-betlar",
    "learningOutcomes": [
      "Qaytar reaksiya zarracha va tezlik grafigi bilan ko‘rsatiladi."
    ],
    "conceptIds": [
      "concept.c130",